{
  "run_version": "agentic-flows.run/v1",
  "flow": {
    "id": "security.audit-trail-reconstruction",
    "version": "0.1.0",
    "source": "flows/security/audit-trail-reconstruction/flow.yaml"
  },
  "run": {
    "id": "run-audit-trail-reconstruction-0001",
    "core": "standalone",
    "status": "completed",
    "started_at": "2026-06-28T09:00:00Z",
    "completed_at": "2026-06-28T09:20:00Z"
  },
  "inputs": {
    "run_sources": {
      "events": [
        "run-991 stream"
      ],
      "approvals": [
        "approval-77"
      ],
      "artifacts": [
        "diff.patch"
      ]
    },
    "incident": "Reconstruct who approved change abc123."
  },
  "outputs": {
    "audit_trail": "14:02 patch applied; 14:05 tests passed; 14:10 operator approved. Source-backed.",
    "gaps": {
      "gaps": [
        "reviewer identity missing from approval record"
      ]
    }
  },
  "artifacts": [
    {
      "id": "reconstructed-timeline",
      "kind": "json",
      "uri": "artifact://runs/run-audit-trail-reconstruction-0001/reconstructed-timeline.json"
    },
    {
      "id": "gap-list",
      "kind": "json",
      "uri": "artifact://runs/run-audit-trail-reconstruction-0001/gap-list.json"
    }
  ],
  "events": [
    {
      "event_version": "agentic-flows.events/v1",
      "flow_id": "security.audit-trail-reconstruction",
      "flow_version": "0.1.0",
      "run_id": "run-audit-trail-reconstruction-0001",
      "event": "flow.started",
      "timestamp": "2026-06-28T09:00:00Z",
      "core": "standalone",
      "severity": "info"
    },
    {
      "event_version": "agentic-flows.events/v1",
      "flow_id": "security.audit-trail-reconstruction",
      "flow_version": "0.1.0",
      "run_id": "run-audit-trail-reconstruction-0001",
      "node_id": "reconstruct",
      "event": "gate.completed",
      "timestamp": "2026-06-28T09:10:00Z",
      "core": "standalone",
      "severity": "info",
      "payload": {
        "gate_id": "timeline-source-backed",
        "status": "passed"
      },
      "evidence": [
        {
          "id": "reconstructed-timeline",
          "kind": "json",
          "uri": "artifact://runs/run-audit-trail-reconstruction-0001/reconstructed-timeline.json"
        }
      ]
    },
    {
      "event_version": "agentic-flows.events/v1",
      "flow_id": "security.audit-trail-reconstruction",
      "flow_version": "0.1.0",
      "run_id": "run-audit-trail-reconstruction-0001",
      "node_id": "verify",
      "event": "gate.completed",
      "timestamp": "2026-06-28T09:15:00Z",
      "core": "standalone",
      "severity": "info",
      "payload": {
        "gate_id": "gaps-marked",
        "status": "passed"
      },
      "evidence": [
        {
          "id": "gap-list",
          "kind": "json",
          "uri": "artifact://runs/run-audit-trail-reconstruction-0001/gap-list.json"
        }
      ]
    },
    {
      "event_version": "agentic-flows.events/v1",
      "flow_id": "security.audit-trail-reconstruction",
      "flow_version": "0.1.0",
      "run_id": "run-audit-trail-reconstruction-0001",
      "event": "flow.completed",
      "timestamp": "2026-06-28T09:20:00Z",
      "core": "standalone",
      "severity": "info"
    }
  ]
}
