{
  "run_version": "agentic-flows.run/v1",
  "flow": {
    "id": "security.supply-chain-audit",
    "version": "0.1.0",
    "source": "flows/security/supply-chain-audit/flow.yaml"
  },
  "run": {
    "id": "run-shc-inventory-0001",
    "core": "standalone",
    "status": "completed",
    "started_at": "2026-06-28T16:00:00Z",
    "completed_at": "2026-06-28T16:09:00Z"
  },
  "inputs": {},
  "outputs": {
    "audit_findings": "artifact://runs/run-shc-inventory-0001/audit_findings",
    "remediation": "artifact://runs/run-shc-inventory-0001/remediation"
  },
  "artifacts": [
    {
      "id": "advisory-report",
      "kind": "advisory-report",
      "uri": "artifact://runs/run-shc-inventory-0001/advisory-report"
    },
    {
      "id": "license-report",
      "kind": "license-report",
      "uri": "artifact://runs/run-shc-inventory-0001/license-report"
    }
  ],
  "events": [
    {
      "event_version": "agentic-flows.events/v1",
      "flow_id": "security.supply-chain-audit",
      "flow_version": "0.1.0",
      "run_id": "run-shc-inventory-0001",
      "event": "flow.started",
      "timestamp": "2026-06-28T16:00:00Z",
      "core": "standalone",
      "severity": "info"
    },
    {
      "event_version": "agentic-flows.events/v1",
      "flow_id": "security.supply-chain-audit",
      "flow_version": "0.1.0",
      "run_id": "run-shc-inventory-0001",
      "event": "gate.completed",
      "timestamp": "2026-06-28T16:01:00Z",
      "core": "standalone",
      "severity": "info",
      "payload": {
        "gate_id": "advisory-sources-captured",
        "status": "passed"
      },
      "evidence": [
        {
          "id": "advisory-report",
          "kind": "advisory-report",
          "uri": "artifact://runs/run-shc-inventory-0001/advisory-report"
        }
      ]
    },
    {
      "event_version": "agentic-flows.events/v1",
      "flow_id": "security.supply-chain-audit",
      "flow_version": "0.1.0",
      "run_id": "run-shc-inventory-0001",
      "event": "gate.completed",
      "timestamp": "2026-06-28T16:02:00Z",
      "core": "standalone",
      "severity": "info",
      "payload": {
        "gate_id": "license-conflicts-reported",
        "status": "passed"
      },
      "evidence": [
        {
          "id": "license-report",
          "kind": "license-report",
          "uri": "artifact://runs/run-shc-inventory-0001/license-report"
        }
      ]
    },
    {
      "event_version": "agentic-flows.events/v1",
      "flow_id": "security.supply-chain-audit",
      "flow_version": "0.1.0",
      "run_id": "run-shc-inventory-0001",
      "event": "flow.completed",
      "timestamp": "2026-06-28T16:09:00Z",
      "core": "standalone",
      "severity": "info"
    }
  ]
}
