{
  "run_version": "agentic-flows.run/v1",
  "flow": {
    "id": "docs.postmortem",
    "version": "0.1.0",
    "source": "flows/docs/postmortem/flow.yaml"
  },
  "run": {
    "id": "run-thinclaw-postmortem-0001",
    "core": "thinclaw",
    "status": "completed",
    "started_at": "2026-06-28T15:20:00Z",
    "completed_at": "2026-06-28T15:22:20Z"
  },
  "inputs": {
    "incident": "The validate CI job failed for 40 minutes after a schema change landed on main.",
    "sources": {
      "events": ["ci-run-991 logs", "commit abc123"]
    }
  },
  "outputs": {
    "postmortem": "# Postmortem: validate CI red for 40m\n\nTimeline cited from ci-run-991 and abc123. Cause: sample not updated.",
    "action_items": {
      "items": [
        {"action": "Add a sample-vs-schema check to pre-merge CI", "owner": "RNT56"}
      ]
    }
  },
  "artifacts": [
    {
      "id": "timeline",
      "kind": "markdown",
      "uri": "artifact://runs/run-thinclaw-postmortem-0001/timeline.md"
    },
    {
      "id": "action-items",
      "kind": "json",
      "uri": "artifact://runs/run-thinclaw-postmortem-0001/action-items.json"
    }
  ],
  "events": [
    {
      "event_version": "agentic-flows.events/v1",
      "flow_id": "docs.postmortem",
      "flow_version": "0.1.0",
      "run_id": "run-thinclaw-postmortem-0001",
      "event": "flow.started",
      "timestamp": "2026-06-28T15:20:00Z",
      "core": "thinclaw",
      "severity": "info"
    },
    {
      "event_version": "agentic-flows.events/v1",
      "flow_id": "docs.postmortem",
      "flow_version": "0.1.0",
      "run_id": "run-thinclaw-postmortem-0001",
      "node_id": "analyze",
      "event": "node.completed",
      "timestamp": "2026-06-28T15:21:00Z",
      "core": "thinclaw",
      "severity": "info"
    },
    {
      "event_version": "agentic-flows.events/v1",
      "flow_id": "docs.postmortem",
      "flow_version": "0.1.0",
      "run_id": "run-thinclaw-postmortem-0001",
      "node_id": "verify",
      "event": "gate.completed",
      "timestamp": "2026-06-28T15:21:50Z",
      "core": "thinclaw",
      "severity": "info",
      "payload": {
        "gate_id": "timeline-cited",
        "status": "passed"
      },
      "evidence": [
        {
          "id": "timeline",
          "kind": "markdown",
          "uri": "artifact://runs/run-thinclaw-postmortem-0001/timeline.md"
        }
      ]
    },
    {
      "event_version": "agentic-flows.events/v1",
      "flow_id": "docs.postmortem",
      "flow_version": "0.1.0",
      "run_id": "run-thinclaw-postmortem-0001",
      "node_id": "verify",
      "event": "gate.completed",
      "timestamp": "2026-06-28T15:22:00Z",
      "core": "thinclaw",
      "severity": "info",
      "payload": {
        "gate_id": "action-items-owned",
        "status": "passed"
      },
      "evidence": [
        {
          "id": "action-items",
          "kind": "json",
          "uri": "artifact://runs/run-thinclaw-postmortem-0001/action-items.json"
        }
      ]
    },
    {
      "event_version": "agentic-flows.events/v1",
      "flow_id": "docs.postmortem",
      "flow_version": "0.1.0",
      "run_id": "run-thinclaw-postmortem-0001",
      "event": "flow.completed",
      "timestamp": "2026-06-28T15:22:20Z",
      "core": "thinclaw",
      "severity": "info"
    }
  ]
}
